{"$schema":"https://json-schema.org/draft/2020-12/schema","type":"object","additionalProperties":false,"required":["schema_version","manifest_sha256","seed","holdout_ratio","development_ratio","calibration_entry_ids","development_entry_ids","holdout_entry_ids","holdout_session_ids"],"properties":{"schema_version":{"const":1},"manifest_sha256":{"type":"string","pattern":"^[0-9a-f]{64}$"},"seed":{"type":"integer"},"holdout_ratio":{"type":"number","exclusiveMinimum":0,"exclusiveMaximum":1},"development_ratio":{"type":"number","exclusiveMinimum":0,"exclusiveMaximum":1},"calibration_entry_ids":{"type":"array","minItems":1,"items":{"type":"string","minLength":1}},"development_entry_ids":{"type":"array","minItems":1,"items":{"type":"string","minLength":1}},"holdout_entry_ids":{"type":"array","minItems":2,"items":{"type":"string","minLength":1}},"holdout_session_ids":{"type":"array","minItems":2,"items":{"type":"string","minLength":1}}}}
