{"schema_version":1,"manifest_sha256":"9c58e560dfd6eb899414d74c7f2d6a19ba73ab98ff3ecbe280638862269021ef","seed":17,"holdout_ratio":0.5,"development_ratio":0.25,"calibration_entry_ids":["0f0da6735c55fb4e50e8e649fef4d47e"],"development_entry_ids":["a026dbe6a0f186f40612b7f08050a2a5"],"holdout_entry_ids":["3920b3b179c39582611e37319c8a8ba2","e7f55bdd2a4b6b0be98663481687bb1c"],"holdout_session_ids":["session-c","session-a"]}
